{
  "$schema": "http://json-schema.org/draft-07/schema#",
  "$id": "https://maga2010.github.io/hackathon-run/schemas/plan.schema.json",
  "title": "Hackathon Plan",
  "description": "Output of scope-knife. Lists every feature with its KEEP/CUT/DEFER classification, the demo path, and a prioritized next-steps task list.",
  "type": "object",
  "required": [
    "version",
    "generated_at",
    "demo_goal",
    "time_remaining_minutes",
    "features",
    "demo_path",
    "next_tasks"
  ],
  "additionalProperties": false,
  "properties": {
    "version": { "const": "1.0" },
    "generated_at": {
      "type": "string",
      "format": "date-time",
      "description": "ISO-8601 UTC timestamp of plan generation."
    },
    "demo_goal": {
      "type": "string",
      "minLength": 1,
      "description": "One-sentence description of what judges should see at the end of the demo."
    },
    "time_remaining_minutes": {
      "type": "integer",
      "minimum": 0,
      "description": "Estimated minutes left in the hackathon."
    },
    "features": {
      "type": "array",
      "description": "Every considered feature, classified.",
      "items": {
        "type": "object",
        "required": ["name", "status", "classification"],
        "additionalProperties": false,
        "properties": {
          "name": { "type": "string", "minLength": 1 },
          "status": {
            "enum": ["implemented", "half-implemented", "unimplemented", "broken"],
            "description": "Current implementation status."
          },
          "classification": {
            "enum": ["KEEP", "CUT", "DEFER"],
            "description": "Scope-knife decision."
          },
          "rationale": {
            "type": "string",
            "description": "One-line reason for the classification."
          },
          "time_estimate_minutes": {
            "type": "integer",
            "minimum": 0
          },
          "passes": {
            "type": "boolean",
            "default": false,
            "description": "Default-FAIL contract: false until an evaluator flips it with evidence."
          },
          "acceptance_criteria": {
            "type": "array",
            "description": "Verifiable criteria that must all pass before this feature is done.",
            "items": { "type": "string", "minLength": 1 }
          },
          "evidence": {
            "type": "array",
            "description": "Machine-checkable evidence collected by fast-verify or the evaluator.",
            "items": {
              "type": "object",
              "required": ["kind", "value"],
              "additionalProperties": false,
              "properties": {
                "kind": {
                  "enum": ["command", "url", "test", "browser", "manual", "log"],
                  "description": "How the evidence was produced."
                },
                "value": { "type": "string", "minLength": 1 },
                "at": { "type": "string", "format": "date-time" }
              }
            }
          },
          "sprint": {
            "type": ["string", "null"],
            "description": "Sprint contract that owns this feature, or null before one is created."
          },
          "owner": {
            "type": "string",
            "description": "Agent or person accountable for the feature."
          },
          "last_verified_at": {
            "type": "string",
            "format": "date-time",
            "description": "When the evaluator last produced evidence for this feature."
          }
        }
      }
    },
    "demo_path": {
      "type": "array",
      "maxItems": 5,
      "description": "Linear sequence of steps the demo follows.",
      "items": {
        "type": "object",
        "required": ["step", "action", "expected_outcome"],
        "additionalProperties": false,
        "properties": {
          "step": { "type": "integer", "minimum": 1 },
          "action": { "type": "string", "minLength": 1 },
          "expected_outcome": { "type": "string", "minLength": 1 },
          "command": {
            "type": "string",
            "minLength": 1,
            "description": "Optional shell command used by fast-verify for automated checking."
          },
          "timeout_seconds": {
            "type": "integer",
            "minimum": 1,
            "description": "Optional command timeout for automated verification."
          }
        }
      }
    },
    "next_tasks": {
      "type": "array",
      "description": "Prioritized task list. P0 = critical path, P1 = polish, P2 = nice-to-have.",
      "items": {
        "type": "object",
        "required": ["priority", "task", "estimate_minutes"],
        "additionalProperties": false,
        "properties": {
          "priority": { "enum": ["P0", "P1", "P2"] },
          "task": { "type": "string", "minLength": 1 },
          "estimate_minutes": { "type": "integer", "minimum": 0 }
        }
      }
    }
  },
  "examples": [
    {
      "version": "1.0",
      "generated_at": "2025-04-19T08:00:00Z",
      "demo_goal": "A user signs up and saves their first note.",
      "time_remaining_minutes": 240,
      "features": [
        {
          "name": "Auth",
          "status": "implemented",
          "classification": "KEEP",
          "rationale": "Core demo path.",
          "time_estimate_minutes": 30,
          "passes": false,
          "acceptance_criteria": ["A user can sign up and the app renders the dashboard."],
          "evidence": []
        },
        {
          "name": "Notes CRUD",
          "status": "half-implemented",
          "classification": "KEEP",
          "rationale": "Core demo path.",
          "time_estimate_minutes": 90,
          "passes": false,
          "acceptance_criteria": ["A user can create, read, update, and delete a note."],
          "evidence": []
        },
        {
          "name": "Search",
          "status": "unimplemented",
          "classification": "CUT",
          "rationale": "Off demo path.",
          "time_estimate_minutes": 120,
          "passes": false,
          "acceptance_criteria": []
        },
        {
          "name": "Dark mode",
          "status": "unimplemented",
          "classification": "DEFER",
          "rationale": "Polish, not critical.",
          "time_estimate_minutes": 60,
          "passes": false,
          "acceptance_criteria": []
        }
      ],
      "demo_path": [
        { "step": 1, "action": "Open the app URL.", "expected_outcome": "Landing page renders." },
        { "step": 2, "action": "Click Sign Up.", "expected_outcome": "Auth modal opens." },
        { "step": 3, "action": "Save a note.", "expected_outcome": "Note appears in list." }
      ],
      "next_tasks": [
        { "priority": "P0", "task": "Finish Notes CRUD.", "estimate_minutes": 90 },
        { "priority": "P1", "task": "Polish Auth.", "estimate_minutes": 30 }
      ]
    }
  ]
}
