{
  "version": "1.0",
  "generated_at": "2025-04-19T08:00:00Z",
  "demo_goal": "A writer signs up, creates a note, and sees it sync across devices in 3 seconds.",
  "time_remaining_minutes": 360,
  "features": [
    {"name": "Auth", "status": "implemented", "classification": "KEEP",
     "rationale": "Core demo path.", "time_estimate_minutes": 30},
    {"name": "Notes CRUD", "status": "implemented", "classification": "KEEP",
     "rationale": "Core demo path.", "time_estimate_minutes": 60},
    {"name": "Search", "status": "unimplemented", "classification": "CUT",
     "rationale": "Off demo path.", "time_estimate_minutes": 120},
    {"name": "Dark mode", "status": "unimplemented", "classification": "DEFER",
     "rationale": "Cosmetic.", "time_estimate_minutes": 60},
    {"name": "Billing", "status": "half-implemented", "classification": "KEEP",
     "rationale": "Core value.", "time_estimate_minutes": 240},
    {"name": "Notifications", "status": "unimplemented", "classification": "CUT",
     "rationale": "Off demo path.", "time_estimate_minutes": 180}
  ],
  "demo_path": [
    {"step": 1, "action": "Open the app URL.", "expected_outcome": "Landing page renders."},
    {"step": 2, "action": "Click Sign Up.", "expected_outcome": "Auth modal opens."},
    {"step": 3, "action": "Create a note.", "expected_outcome": "Note appears in list."},
    {"step": 4, "action": "Switch to mobile in another tab.", "expected_outcome": "Note syncs instantly."}
  ],
  "next_tasks": [
    {"priority": "P0", "task": "Verify demo path end-to-end.", "estimate_minutes": 30},
    {"priority": "P0", "task": "Finish Billing webhook.", "estimate_minutes": 240},
    {"priority": "P1", "task": "Polish Auth flow.", "estimate_minutes": 30}
  ]
}
